{
  "sample_id": "20260626_medlatec_001",
  "hospital": "medlatec",
  "report_type": "lab_result",
  "language": "vi",
  "test_date": "2026-06-26",
  "source": {
    "uploaded_by": "synthetic",
    "anonymized": true,
    "contains_phi": false
  },
  "rows": [
    {
      "row_index": 1,
      "original_test_name": "Glucose",
      "display_name_vi": "Đường huyết lúc đói",
      "mapped_metric_type": "fasting_glucose",
      "value": 6.3,
      "unit": "mmol/L",
      "reference_range": "3.9–6.1",
      "status": "high"
    },
    {
      "row_index": 2,
      "original_test_name": "HbA1c",
      "display_name_vi": "Huyết sắc tố glycat hóa",
      "mapped_metric_type": "hba1c",
      "value": 6.8,
      "unit": "%",
      "reference_range": "< 6.5",
      "status": "high"
    },
    {
      "row_index": 3,
      "original_test_name": "Cholesterol TP",
      "display_name_vi": "Cholesterol toàn phần",
      "mapped_metric_type": "total_cholesterol",
      "value": 5.1,
      "unit": "mmol/L",
      "reference_range": "< 5.2",
      "status": "normal"
    },
    {
      "row_index": 4,
      "original_test_name": "HDL-Cholesterol",
      "display_name_vi": "Cholesterol tốt (HDL)",
      "mapped_metric_type": "hdl",
      "value": 1.05,
      "unit": "mmol/L",
      "reference_range": "> 1.0",
      "status": "normal"
    },
    {
      "row_index": 5,
      "original_test_name": "LDL-Cholesterol",
      "display_name_vi": "Cholesterol xấu (LDL)",
      "mapped_metric_type": "ldl",
      "value": 3.45,
      "unit": "mmol/L",
      "reference_range": "< 3.4",
      "status": "high"
    },
    {
      "row_index": 6,
      "original_test_name": "Triglycerid",
      "display_name_vi": "Chất béo trung tính",
      "mapped_metric_type": "triglyceride",
      "value": 1.58,
      "unit": "mmol/L",
      "reference_range": "< 1.7",
      "status": "normal"
    },
    {
      "row_index": 7,
      "original_test_name": "Ure",
      "display_name_vi": "Urê máu",
      "mapped_metric_type": "urea",
      "value": 5.8,
      "unit": "mmol/L",
      "reference_range": "2.5–7.5",
      "status": "normal"
    },
    {
      "row_index": 8,
      "original_test_name": "Creatinine",
      "display_name_vi": "Creatinine máu",
      "mapped_metric_type": "creatinine",
      "value": 82.0,
      "unit": "µmol/L",
      "reference_range": "62–106",
      "status": "normal"
    },
    {
      "row_index": 9,
      "original_test_name": "AST",
      "display_name_vi": "Men gan AST",
      "mapped_metric_type": "ast",
      "value": 38.0,
      "unit": "U/L",
      "reference_range": "< 40",
      "status": "normal"
    },
    {
      "row_index": 10,
      "original_test_name": "ALT",
      "display_name_vi": "Men gan ALT",
      "mapped_metric_type": "alt",
      "value": 52.0,
      "unit": "U/L",
      "reference_range": "< 40",
      "status": "high"
    },
    {
      "row_index": 11,
      "original_test_name": "TSH",
      "display_name_vi": "Hormone kích thích tuyến giáp",
      "mapped_metric_type": "tsh",
      "value": 2.45,
      "unit": "mIU/L",
      "reference_range": "0.27–4.20",
      "status": "normal"
    },
    {
      "row_index": 12,
      "original_test_name": "Acid Uric",
      "display_name_vi": "Acid uric máu",
      "mapped_metric_type": "uric_acid",
      "value": 428.0,
      "unit": "µmol/L",
      "reference_range": "202–416",
      "status": "high"
    }
  ]
}
