{
  "sample_id": "20260626_tamanh_001",
  "hospital": "tamanh",
  "report_type": "lab_result",
  "language": "vi",
  "test_date": "2026-06-26",
  "source": {
    "uploaded_by": "synthetic",
    "anonymized": true,
    "contains_phi": false
  },
  "rows": [
    {
      "row_index": 1,
      "original_test_name": "Đường huyết lúc đói",
      "display_name_vi": "Đường huyết lúc đói",
      "mapped_metric_type": "fasting_glucose",
      "value": 5.4,
      "unit": "mmol/L",
      "reference_range": "3.9–6.1",
      "status": "normal"
    },
    {
      "row_index": 2,
      "original_test_name": "HbA1c",
      "display_name_vi": "Huyết sắc tố glycat hóa",
      "mapped_metric_type": "hba1c",
      "value": 5.9,
      "unit": "%",
      "reference_range": "< 6.5",
      "status": "normal"
    },
    {
      "row_index": 3,
      "original_test_name": "Cholesterol",
      "display_name_vi": "Cholesterol toàn phần",
      "mapped_metric_type": "total_cholesterol",
      "value": 5.6,
      "unit": "mmol/L",
      "reference_range": "< 5.2",
      "status": "high"
    },
    {
      "row_index": 4,
      "original_test_name": "HDL Cholesterol",
      "display_name_vi": "Cholesterol tốt (HDL)",
      "mapped_metric_type": "hdl",
      "value": 0.95,
      "unit": "mmol/L",
      "reference_range": "> 1.0",
      "status": "low"
    },
    {
      "row_index": 5,
      "original_test_name": "LDL Cholesterol",
      "display_name_vi": "Cholesterol xấu (LDL)",
      "mapped_metric_type": "ldl",
      "value": 3.21,
      "unit": "mmol/L",
      "reference_range": "< 3.4",
      "status": "normal"
    },
    {
      "row_index": 6,
      "original_test_name": "Triglycerides",
      "display_name_vi": "Chất béo trung tính",
      "mapped_metric_type": "triglyceride",
      "value": 2.1,
      "unit": "mmol/L",
      "reference_range": "< 1.7",
      "status": "high"
    },
    {
      "row_index": 7,
      "original_test_name": "Urê",
      "display_name_vi": "Urê máu",
      "mapped_metric_type": "urea",
      "value": 4.8,
      "unit": "mmol/L",
      "reference_range": "2.5–7.5",
      "status": "normal"
    },
    {
      "row_index": 8,
      "original_test_name": "Creatinine",
      "display_name_vi": "Creatinine máu",
      "mapped_metric_type": "creatinine",
      "value": 71.0,
      "unit": "µmol/L",
      "reference_range": "62–106",
      "status": "normal"
    },
    {
      "row_index": 9,
      "original_test_name": "SGOT (AST)",
      "display_name_vi": "Men gan AST",
      "mapped_metric_type": "ast",
      "value": 28.0,
      "unit": "U/L",
      "reference_range": "< 40",
      "status": "normal"
    },
    {
      "row_index": 10,
      "original_test_name": "SGPT (ALT)",
      "display_name_vi": "Men gan ALT",
      "mapped_metric_type": "alt",
      "value": 31.0,
      "unit": "U/L",
      "reference_range": "< 40",
      "status": "normal"
    }
  ]
}
